### ISSUE TITLE
ClusterLoader2: Add alternative method for checking prometheus targets

### ISSUE THREAD

**Issue by learnitall** [kubernetes/perf-tests#2319]
**What would you like to be added**:
When deploying prometheus through the `--enable-prometheus-server` option, CL2 checks that the deployed prometheus service is ready to go before kicking off tests. One step in this process is ensuring that all of the configured targets are ready, which requires accessing the prometheus instance's `api/v1/targets` endpoint. This is performed in the function  [pkg/prometheus/util.go:CheckTargetsReady](https://github.com/kubernetes/perf-tests/blob/e353d7c97db46f0c96a65e09559a0b011e82f7ba/clusterloader2/pkg/prometheus/util.go#L61), and uses the [k8s apiserver bastion proxy](https://kubernetes.io/docs/tasks/access-application-cluster/access-cluster-services/#manually-constructing-apiserver-proxy-urls) to access the prometheus service, like this

https://github.com/kubernetes/perf-tests/blob/e353d7c97db46f0c96a65e09559a0b011e82f7ba/clusterloader2/pkg/prometheus/util.go#L61-L74

I would like to modify this function to change the method used for accessing prometheus, removing the use of the k8s apiserver proxy.

**Why is this needed**:
The current method assumes that control plane nodes have access to the prometheus pod, which may not be true in all environments. For instance, running CL2 on a cluster deployed to GCP using [kops](github.com/kubernetes/kops) requires adding an extra firewall rule to allow cp nodes to reach prometheus. Before creating this extra firewall rule, I see the following output from CL2:

```
2023-09-27T20:56:46.5167468Z W0927 20:56:46.516455    8456 util.go:72] error while calling prometheus api: the server is currently unable to handle the request (get services http:prometheus-k8s:9090), response: k8s�
2023-09-27T20:56:46.5168244Z 
2023-09-27T20:56:46.5168662Z v1Statusn
2023-09-27T20:56:46.5169069Z 
2023-09-27T20:56:46.5170082Z ���FailureDerror trying to reach service: dial tcp 10.0.1.119:9090: i/o timeout"ServiceUnavailable0��"�
```

And the following SYNs on the control plane node:

```
root@control-plane-us-west1-a-6jn5:/home/cilium# tcpdump -i any port 9090
tcpdump: data link type LINUX_SLL2
tcpdump: verbose output suppressed, use -v[v]... for full protocol decode
listening on any, link-type LINUX_SLL2 (Linux cooked v2), snapshot length 262144 bytes
22:29:34.699095 cilium_vxlan Out IP 10.0.0.197.33488 > 10.0.1.119.9090: Flags [S], seq 1532884023, win 42470, options [mss 1370,sackOK,TS val 1435623945 ecr 0,nop,wscale 9], length 0
22:29:35.705435 cilium_vxlan Out IP 10.0.0.197.33488 > 10.0.1.119.9090: Flags [S], seq 1532884023, win 42470, options [mss 1370,sackOK,TS val 1435624951 ecr 0,nop,wscale 9], length 0
22:29:37.725394 cilium_vxlan Out IP 10.0.0.197.33488 > 10.0.1.119.9090: Flags [S], seq 1532884023, win 42470, options [mss 1370,sackOK,TS val 1435626971 ecr 0,nop,wscale 9], length 0
22:29:41.817445 cilium_vxlan Out IP 10.0.0.197.33488 > 10.0.1.119.9090: Flags [S], seq 1532884023, win 42470, options [mss 1370,sackOK,TS val 1435631063 ecr 0,nop,wscale 9], length 0
^C
4 packets captured
17 packets received by filter
0 packets dropped by kernel
```

where `10.0.0.197` is the control plane's host IP and `10.0.1.119` is the IP of the prometheus pod.

Creating an extra firewall rule isn't a problem, but this issue is really tricky to debug when coming across it for the first time. We could document this and call it a day, however I think it would be fairly simple to instead access prometheus by kicking off an exec pod that runs a quick `curl`. There is already code as part of the exec service which can be extracted and reused for this purpose:

https://github.com/kubernetes/perf-tests/blob/e353d7c97db46f0c96a65e09559a0b011e82f7ba/clusterloader2/pkg/execservice/exec_service.go#L138-L146

This will help save new users and existing users some headaches when using CL2 on clusters deployed in a more restricted or customized environment.

**Comment by learnitall** [comment]
CC: @marseel
